{"$schema": "https://json-schema.org/draft/2020-12/schema", "additionalProperties": false, "properties": {"expected_jobs_sha256": {"pattern": "^[a-f0-9]{64}$", "type": "string"}, "fresh_gemini_execution_proven": {"const": false}, "groups_per_package": {"const": 14}, "input_archive_sha256": {"const": "e2edfbfa1b4840f1204e0ed9e9213e17798c0a8f7169a92dd53fba814cf4bbdd"}, "live_make_execution_proven": {"const": false}, "packages": {"minimum": 1, "type": "integer"}, "publication_authorized": {"const": false}, "request_id": {"const": "P0E4_V154_PREFLIGHT_A"}, "result_sha256": {"pattern": "^[a-f0-9]{64}$", "type": "string"}, "schema": {"const": "CLAUDE_PREFLIGHT_VALIDATION"}, "schema_version": {"const": 1}, "scope": {"const": "SYNTHETIC_PREFLIGHT_ONLY"}, "semantic_drift": {"const": false}, "status": {"const": "PASS"}}, "required": ["schema", "schema_version", "status", "request_id", "input_archive_sha256", "result_sha256", "expected_jobs_sha256", "groups_per_package", "packages", "semantic_drift", "scope", "live_make_execution_proven", "fresh_gemini_execution_proven", "publication_authorized"], "type": "object"}
